{
  "reportId": "REPORT-PHASE6-PILOT-2026-03",
  "evaluationDate": "2026-09-10",
  "pilotId": "PILOT-DPS-JR-2026-03",
  "tier": "KINDERGARTEN_JUNIOR",
  "verdict": "GO_TO_PHASE_7",
  "criteriaResults": [
    {
      "criterionId": "CRIT-P6-01",
      "name": "Verifiable Parental Consent (VPC)",
      "target": "100% verified parental consent",
      "actual": "100.0% (15/15)",
      "status": "PASSED"
    },
    {
      "criterionId": "CRIT-P6-02",
      "name": "Early Childhood Emotional Safety",
      "target": "0 distress triggers or safety incidents",
      "actual": "0 incidents",
      "status": "PASSED"
    },
    {
      "criterionId": "CRIT-P6-03",
      "name": "Facilitator Friction & Routing-Around",
      "target": "< 5.0% facilitator bypass rate",
      "actual": "0.3% (1/300)",
      "status": "PASSED"
    },
    {
      "criterionId": "CRIT-P6-04",
      "name": "Foundational Numeracy & Phonics Growth",
      "target": ">= +0.30 average mastery gain",
      "actual": "+0.45 delta P(L)",
      "status": "PASSED"
    },
    {
      "criterionId": "CRIT-P6-05",
      "name": "Voice-First Interactive Latency",
      "target": "< 300ms P95 response time",
      "actual": "235.6ms",
      "status": "PASSED"
    }
  ],
  "safetySummary": {
    "distressTriggersDetected": 0,
    "screenTimeEnforcementRate": 1.0,
    "parentCopilotActiveRate": 1.0
  },
  "signoffs": [
    {
      "role": "Founder & System Architect",
      "name": "Dr. Arvind Patel",
      "organization": "YOUVA-EdAi Core Leadership",
      "decision": "APPROVED",
      "date": "2026-09-10T14:00:00Z"
    },
    {
      "role": "Early Childhood Specialist & Pilot Lead",
      "name": "Dr. Sunita Sen",
      "organization": "Foundational Learning Initiative",
      "decision": "APPROVED",
      "date": "2026-09-10T15:30:00Z"
    },
    {
      "role": "Certified Child Safety Officer",
      "name": "Dr. Priya Deshpande",
      "organization": "Independent Child Wellbeing & Digital Safety Council",
      "decision": "APPROVED",
      "date": "2026-09-10T17:00:00Z"
    }
  ]
}
